[
  {
    "key": "title",
    "label": "Title",
    "type": "string",
    "core": true,
    "required": true,
    "group": "core"
  },
  {
    "key": "status",
    "label": "Status",
    "type": "enum",
    "core": true,
    "group": "core"
  },
  {
    "key": "description",
    "label": "Description",
    "type": "text",
    "group": "core"
  },
  {
    "key": "assignee",
    "label": "Assignee",
    "type": "user",
    "group": "people"
  },
  {
    "key": "reporter",
    "label": "Reporter",
    "type": "user",
    "group": "people"
  },
  {
    "key": "watchers",
    "label": "Watchers",
    "type": "labels",
    "group": "people"
  },
  {
    "key": "priority",
    "label": "Priority",
    "type": "enum",
    "group": "classification"
  },
  {
    "key": "labels",
    "label": "Labels",
    "type": "labels",
    "group": "classification"
  },
  {
    "key": "type",
    "label": "Work item type",
    "type": "enum",
    "group": "classification"
  },
  {
    "key": "component",
    "label": "Component",
    "type": "string",
    "group": "classification"
  },
  {
    "key": "resolution",
    "label": "Resolution",
    "type": "enum",
    "group": "classification"
  },
  {
    "key": "severity",
    "label": "Severity",
    "type": "enum",
    "group": "classification"
  },
  {
    "key": "fixVersion",
    "label": "Fix version",
    "type": "string",
    "group": "classification"
  },
  {
    "key": "environment",
    "label": "Environment",
    "type": "string",
    "group": "classification"
  },
  {
    "key": "startDate",
    "label": "Start date",
    "type": "date",
    "group": "schedule"
  },
  {
    "key": "dueDate",
    "label": "Due date",
    "type": "date",
    "group": "schedule"
  },
  {
    "key": "milestone",
    "label": "Milestone",
    "type": "enum",
    "group": "schedule"
  },
  {
    "key": "baselineStart",
    "label": "Baseline start",
    "type": "date",
    "group": "schedule"
  },
  {
    "key": "baselineFinish",
    "label": "Baseline finish",
    "type": "date",
    "group": "schedule"
  },
  {
    "key": "estimateHours",
    "label": "Estimate (h)",
    "type": "number",
    "group": "effort"
  },
  {
    "key": "loggedHours",
    "label": "Logged (h)",
    "type": "number",
    "group": "effort"
  },
  {
    "key": "remainingHours",
    "label": "Remaining (h)",
    "type": "number",
    "group": "effort"
  },
  {
    "key": "storyPoints",
    "label": "Story points",
    "type": "number",
    "group": "agile"
  },
  {
    "key": "sprint",
    "label": "Sprint",
    "type": "string",
    "group": "agile"
  },
  {
    "key": "epic",
    "label": "Epic",
    "type": "string",
    "group": "agile"
  },
  {
    "key": "rank",
    "label": "Rank",
    "type": "number",
    "group": "agile"
  },
  {
    "key": "actualStart",
    "label": "Actual start",
    "type": "date",
    "group": "schedule"
  },
  {
    "key": "actualFinish",
    "label": "Actual finish",
    "type": "date",
    "group": "schedule"
  },
  {
    "key": "totalFloat",
    "label": "Total float",
    "type": "duration",
    "group": "schedule"
  },
  {
    "key": "criticalPath",
    "label": "On critical path",
    "type": "boolean",
    "group": "schedule"
  },
  {
    "key": "constraintType",
    "label": "Constraint type",
    "type": "enum",
    "group": "schedule"
  },
  {
    "key": "slaDueAt",
    "label": "SLA due at",
    "type": "date",
    "group": "service"
  },
  {
    "key": "originalEstimateHours",
    "label": "Original estimate (h)",
    "type": "number",
    "group": "effort"
  },
  {
    "key": "percentWorkComplete",
    "label": "% work complete",
    "type": "percent",
    "group": "effort"
  },
  {
    "key": "acceptanceCriteria",
    "label": "Acceptance criteria",
    "type": "text",
    "group": "agile"
  },
  {
    "key": "businessValue",
    "label": "Business value",
    "type": "number",
    "group": "agile"
  },
  {
    "key": "riceScore",
    "label": "RICE score",
    "type": "number",
    "group": "agile"
  },
  {
    "key": "wsjf",
    "label": "WSJF",
    "type": "number",
    "group": "agile"
  },
  {
    "key": "moscow",
    "label": "MoSCoW",
    "type": "enum",
    "group": "agile"
  },
  {
    "key": "confidence",
    "label": "Confidence",
    "type": "percent",
    "group": "agile"
  },
  {
    "key": "budget",
    "label": "Budget",
    "type": "number",
    "group": "financial"
  },
  {
    "key": "plannedCost",
    "label": "Planned cost",
    "type": "number",
    "group": "financial"
  },
  {
    "key": "actualCost",
    "label": "Actual cost",
    "type": "number",
    "group": "financial"
  },
  {
    "key": "currency",
    "label": "Currency",
    "type": "string",
    "group": "financial"
  },
  {
    "key": "billable",
    "label": "Billable",
    "type": "enum",
    "group": "financial"
  },
  {
    "key": "costCenter",
    "label": "Cost centre",
    "type": "string",
    "group": "financial"
  },
  {
    "key": "plannedValue",
    "label": "Planned value (PV)",
    "type": "currency",
    "group": "financial"
  },
  {
    "key": "earnedValue",
    "label": "Earned value (EV)",
    "type": "currency",
    "group": "financial"
  },
  {
    "key": "budgetAtCompletion",
    "label": "Budget at completion (BAC)",
    "type": "currency",
    "group": "financial"
  },
  {
    "key": "estimateAtCompletion",
    "label": "Estimate at completion (EAC)",
    "type": "currency",
    "group": "financial"
  },
  {
    "key": "estimateToComplete",
    "label": "Estimate to complete (ETC)",
    "type": "currency",
    "group": "financial"
  },
  {
    "key": "costVariance",
    "label": "Cost variance (CV)",
    "type": "currency",
    "group": "financial"
  },
  {
    "key": "scheduleVariance",
    "label": "Schedule variance (SV)",
    "type": "currency",
    "group": "financial"
  },
  {
    "key": "costPerformanceIndex",
    "label": "CPI",
    "type": "number",
    "group": "financial"
  },
  {
    "key": "schedulePerformanceIndex",
    "label": "SPI",
    "type": "number",
    "group": "financial"
  },
  {
    "key": "billRate",
    "label": "Bill rate",
    "type": "currency",
    "group": "financial"
  },
  {
    "key": "costRate",
    "label": "Cost rate",
    "type": "currency",
    "group": "financial"
  },
  {
    "key": "committedCost",
    "label": "Committed cost (PO)",
    "type": "currency",
    "group": "financial"
  },
  {
    "key": "purchaseOrder",
    "label": "Purchase order",
    "type": "string",
    "group": "financial"
  },
  {
    "key": "revenue",
    "label": "Revenue",
    "type": "currency",
    "group": "financial"
  },
  {
    "key": "invoicedAmount",
    "label": "Invoiced",
    "type": "currency",
    "group": "financial"
  },
  {
    "key": "margin",
    "label": "Margin",
    "type": "percent",
    "group": "financial"
  },
  {
    "key": "capitalised",
    "label": "Capitalised (capex)",
    "type": "boolean",
    "group": "financial"
  },
  {
    "key": "wbsCode",
    "label": "WBS code",
    "type": "string",
    "group": "financial"
  },
  {
    "key": "healthStatus",
    "label": "Health (RAG)",
    "type": "enum",
    "group": "quality"
  },
  {
    "key": "riskLevel",
    "label": "Risk level",
    "type": "enum",
    "group": "quality"
  },
  {
    "key": "impact",
    "label": "Impact",
    "type": "enum",
    "group": "quality"
  },
  {
    "key": "urgency",
    "label": "Urgency",
    "type": "enum",
    "group": "quality"
  },
  {
    "key": "blocked",
    "label": "Blocked",
    "type": "boolean",
    "group": "quality"
  },
  {
    "key": "blockedReason",
    "label": "Blocked reason",
    "type": "string",
    "group": "quality"
  },
  {
    "key": "mitigation",
    "label": "Mitigation",
    "type": "text",
    "group": "quality"
  },
  {
    "key": "defectCount",
    "label": "Defect count",
    "type": "number",
    "group": "quality"
  },
  {
    "key": "dealValue",
    "label": "Deal value",
    "type": "currency",
    "group": "crm"
  },
  {
    "key": "dealProbability",
    "label": "Win probability",
    "type": "percent",
    "group": "crm"
  },
  {
    "key": "forecastProbability",
    "label": "Forecast probability",
    "type": "percent",
    "group": "crm"
  },
  {
    "key": "forecastCategory",
    "label": "Forecast category",
    "type": "enum",
    "group": "crm"
  },
  {
    "key": "dealStatus",
    "label": "Deal status",
    "type": "enum",
    "group": "crm"
  },
  {
    "key": "dealStage",
    "label": "Deal stage",
    "type": "reference",
    "references": "pipeline",
    "group": "crm"
  },
  {
    "key": "pipeline",
    "label": "Pipeline",
    "type": "reference",
    "references": "pipeline",
    "group": "crm"
  },
  {
    "key": "dealOwner",
    "label": "Deal owner",
    "type": "user",
    "group": "crm"
  },
  {
    "key": "account",
    "label": "Account",
    "type": "reference",
    "references": "account",
    "group": "crm"
  },
  {
    "key": "contact",
    "label": "Contact",
    "type": "reference",
    "references": "contact",
    "group": "crm"
  },
  {
    "key": "leadSource",
    "label": "Lead source",
    "type": "enum",
    "group": "crm"
  },
  {
    "key": "nextStep",
    "label": "Next step",
    "type": "string",
    "group": "crm"
  },
  {
    "key": "expectedCloseDate",
    "label": "Expected close date",
    "type": "date",
    "group": "crm"
  },
  {
    "key": "slaBreached",
    "label": "SLA breached",
    "type": "boolean",
    "group": "service"
  },
  {
    "key": "firstResponseAt",
    "label": "First response at",
    "type": "date",
    "group": "service"
  },
  {
    "key": "resolvedAt",
    "label": "Resolved at",
    "type": "date",
    "group": "service"
  },
  {
    "key": "reopenCount",
    "label": "Reopen count",
    "type": "number",
    "group": "service"
  },
  {
    "key": "csatScore",
    "label": "CSAT score",
    "type": "number",
    "group": "service"
  },
  {
    "key": "csatComment",
    "label": "CSAT comment",
    "type": "text",